{"$defs":{"derivationRule":{"additionalProperties":false,"properties":{"id":{"enum":["CE-MAP-A2C-01","CE-MAP-A2C-02"]},"version":{"const":"1.0.0"}},"required":["id","version"],"type":"object"},"eref":{"minLength":1,"pattern":"^[A-Za-z][A-Za-z0-9._:-]*$","type":"string"},"hashRecord":{"additionalProperties":false,"properties":{"algorithm":{"const":"sha256"},"canonicalization":{"const":"ev4-canonical-json.v1"},"scope":{"const":"source_bundle"},"value":{"pattern":"^[a-f0-9]{64}$","type":"string"}},"required":["algorithm","canonicalization","scope","value"],"type":"object"},"id":{"minLength":1,"pattern":"^[A-Za-z][A-Za-z0-9._:-]*$","type":"string"},"mappingTraceItem":{"additionalProperties":false,"allOf":[{"if":{"properties":{"classification":{"const":"deterministic_derived_metadata"}},"required":["classification"]},"then":{"required":["derivation_rule"]},"else":{"not":{"required":["derivation_rule"]}}}],"properties":{"classification":{"enum":["direct_evidence_copy","allowed_representation_conversion","deterministic_structural_projection","deterministic_derived_metadata","not_applicable","unsupported"]},"derivation_rule":{"$ref":"#/$defs/derivationRule"},"duplicate_behavior":{"enum":["reject","deduplicate_stable_order","preserve","not_applicable"]},"missing_source_behavior":{"enum":["invalid","insufficient_evidence","omit_if_optional","not_applicable"]},"ordering_rule":{"enum":["preserve_source_order","sort_by_id","sort_by_source_path_then_target_path","not_applicable"]},"provenance_behavior":{"enum":["copy_exact","preserve_reference","not_applicable"]},"source_path":{"$ref":"#/$defs/s"},"target_path":{"$ref":"#/$defs/s"},"unresolved_evidence_behavior":{"enum":["copy_exact","preserve_unresolved","not_applicable"]},"unsupported_field_behavior":{"enum":["reject","preserve_as_provenance_only","not_applicable"]}},"required":["source_path","target_path","classification","ordering_rule","missing_source_behavior","duplicate_behavior","unsupported_field_behavior","provenance_behavior","unresolved_evidence_behavior"],"type":"object"},"refs":{"items":{"$ref":"#/$defs/eref"},"minItems":1,"type":"array","uniqueItems":true},"s":{"minLength":1,"pattern":"\\S","type":"string"},"state":{"enum":["observed","validated","resolved","derived","proposed","unverified","insufficient_evidence"]}},"$id":"https://github.com/rezahh107/EV4-Constructability-Engineer-Repo/schemas/ce_architect_stage_intake.v1_1.schema.json","$schema":"https://json-schema.org/draft/2020-12/schema","additionalProperties":false,"allOf":[{"if":{"properties":{"intake_status":{"const":"insufficient_evidence"}},"required":["intake_status"]},"then":{"properties":{"missing_evidence":{"minItems":1}},"required":["missing_evidence"]}}],"properties":{"architect_intent_preserved":{"additionalProperties":false,"properties":{"class_intent":{"additionalProperties":false,"properties":{"approved_class_names":{"items":{"pattern":"^[a-z][a-z0-9-]*(?:__[a-z0-9-]+)?(?:--[a-z0-9-]+)?$","type":"string"},"minItems":1,"type":"array","uniqueItems":true}},"required":["approved_class_names"],"type":"object"},"dynamic_loop_intent":{"additionalProperties":false,"properties":{"evidence_refs":{"items":{"$ref":"#/$defs/eref"},"type":"array","uniqueItems":true},"status":{"enum":["none","not_applicable","possible","unknown","approved"]}},"required":["status","evidence_refs"],"type":"object"},"responsive_risk_seeds":{"items":{"additionalProperties":false,"properties":{"evidence_refs":{"$ref":"#/$defs/refs"},"risk_id":{"$ref":"#/$defs/id"},"state":{"const":"insufficient_evidence"}},"required":["risk_id","state","evidence_refs"],"type":"object"},"minItems":1,"type":"array"}},"required":["class_intent","responsive_risk_seeds","dynamic_loop_intent"],"type":"object"},"ce_processing_prerequisites":{"additionalProperties":false,"properties":{"ce_review_required":{"const":true},"intake_contains_builder_authorization":{"const":false},"intake_contains_ce_conclusions":{"const":false},"real_cross_repository_validation_available":{"const":false}},"required":["ce_review_required","intake_contains_ce_conclusions","intake_contains_builder_authorization","real_cross_repository_validation_available"],"type":"object"},"evidence_register":{"items":{"additionalProperties":false,"properties":{"claim":{"$ref":"#/$defs/s"},"evidence_id":{"$ref":"#/$defs/eref"},"fact_class":{"enum":["project_specific_behavior","platform_capability","project_default","project_conceptual_model","unresolved_unknown","audit_finding","contract_rule","not_claimed","synthetic_fixture","transition_provenance"]},"source_ref":{"additionalProperties":false,"properties":{"reference":{"$ref":"#/$defs/s"},"source_type":{"enum":["stage_payload","repo_path","contract","schema","fixture","manual_observation","synthetic_fixture","transition_result"]}},"required":["source_type","reference"],"type":"object"},"state":{"$ref":"#/$defs/state"}},"required":["evidence_id","state","source_ref","claim","fact_class"],"type":"object"},"minItems":1,"type":"array","uniqueItems":true},"forbidden_work":{"items":{"$ref":"#/$defs/s"},"minItems":1,"type":"array","uniqueItems":true},"intake_status":{"enum":["complete","insufficient_evidence"]},"legacy_contract_policy":{"additionalProperties":false,"properties":{"canonical_architect_facing_intake":{"const":"ev4-ce-architect-stage-intake@1.1.0"},"legacy_status":{"const":"v1.0.0_historical_compatibility"}},"required":["canonical_architect_facing_intake","legacy_status"],"type":"object"},"mapping_contract":{"additionalProperties":false,"properties":{"mapping_id":{"const":"ev4-architect-stage-to-ce-intake-mapping@1.1.0"},"mapping_version":{"const":"1.1.0"},"source_schema_id":{"const":"ev4-architect-stage-payload@1.0.0"},"target_schema_id":{"const":"ev4-ce-architect-stage-intake@1.1.0"}},"required":["mapping_id","mapping_version","source_schema_id","target_schema_id"],"type":"object"},"mapping_trace":{"items":{"$ref":"#/$defs/mappingTraceItem"},"minItems":1,"type":"array"},"missing_evidence":{"items":{"additionalProperties":false,"properties":{"affected_ce_conclusion":{"enum":["intake_acceptance","constructability_review_scope","implementation_strategy","builder_authorization","responsive_validation","production_readiness"]},"ce_processing_can_partially_continue":{"type":"boolean"},"current_evidence_owner":{"enum":["architect","ce","builder","responsive","user","unresolved"]},"missing_id":{"$ref":"#/$defs/id"},"required_source":{"$ref":"#/$defs/s"}},"required":["missing_id","affected_ce_conclusion","required_source","current_evidence_owner","ce_processing_can_partially_continue"],"type":"object"},"type":"array"},"negative_boundary_assertions":{"additionalProperties":false,"properties":{"builder_action_authorized":{"const":false},"builder_executable":{"const":false},"builder_ready":{"const":false},"builder_runtime_intake_authorized":{"const":false},"ce_approved":{"const":false},"ce_review_complete":{"const":false},"constructability_proven":{"const":false},"elementor_feasibility_proven":{"const":false},"implementation_strategy_selected":{"const":false},"production_ready":{"const":false},"proof_state_resolved":{"const":false},"responsive_complete":{"const":false}},"required":["constructability_proven","ce_approved","implementation_strategy_selected","elementor_feasibility_proven","proof_state_resolved","ce_review_complete","builder_ready","builder_executable","builder_action_authorized","builder_runtime_intake_authorized","production_ready","responsive_complete"],"type":"object"},"owner_repository":{"const":"rezahh107/EV4-Constructability-Engineer-Repo"},"continuation_assurance":{"description":"Optional EV4-PCVP@1.0.0 carrier. The repository-owned semantic validator resolves the immutable canonical schemas and cross-record rules.","type":"object"},"project_gate_transition":{"additionalProperties":false,"properties":{"executed":{"const":true},"producer_repository":{"const":"rezahh107/EV4-Project-Gate"},"source_bundle_hash":{"$ref":"#/$defs/hashRecord"},"source_bundle_id":{"$ref":"#/$defs/id"},"transition_id":{"const":"ev4-architect-to-ce-transition@1.0.0"},"transition_version":{"const":"1.0.0"}},"required":["executed","transition_id","transition_version","producer_repository","source_bundle_id","source_bundle_hash"],"type":"object"},"real_cross_repository_validation":{"const":"not_available"},"schema_id":{"const":"ev4-ce-architect-stage-intake@1.1.0"},"schema_version":{"const":"1.1.0"},"selected_architecture":{"additionalProperties":false,"properties":{"approved_structure_ref":{"$ref":"#/$defs/id"},"architecture_family":{"$ref":"#/$defs/s"},"decision_source_refs":{"$ref":"#/$defs/refs"},"selected_candidate_id":{"$ref":"#/$defs/id"},"selected_candidate_locked":{"const":true}},"required":["selected_candidate_id","selected_candidate_locked","architecture_family","decision_source_refs","approved_structure_ref"],"type":"object"},"source_contract":{"additionalProperties":false,"properties":{"accepted_main_merge_commit":{"const":"b0651668b97f682bb17f66840c8e8c503fd3935d"},"owner_repository":{"const":"rezahh107/EV4-Architect-Repo"},"schema_id":{"const":"ev4-architect-stage-payload@1.0.0"},"schema_version":{"const":"1.0.0"}},"required":["schema_id","schema_version","owner_repository","accepted_main_merge_commit"],"type":"object"},"source_repository_ref":{"additionalProperties":false,"properties":{"bundle_id":{"$ref":"#/$defs/id"},"commit_sha":{"pattern":"^[a-f0-9]{40}$","type":"string"},"ref":{"$ref":"#/$defs/s"},"repository":{"const":"rezahh107/EV4-Architect-Repo"}},"required":["repository","ref","bundle_id"],"type":"object"},"structure_projection":{"additionalProperties":false,"properties":{"nodes":{"items":{"additionalProperties":false,"properties":{"children":{"items":{"$ref":"#/$defs/id"},"type":"array","uniqueItems":true},"evidence_refs":{"$ref":"#/$defs/refs"},"node_kind":{"enum":["section_root","structural_container","content_group","widget","decoration_layer","overlay_stage","connector_layer","wrapper","component_candidate"]},"parent_node_id":{"anyOf":[{"type":"null"},{"$ref":"#/$defs/id"}]},"role":{"$ref":"#/$defs/s"},"source_node_id":{"$ref":"#/$defs/id"}},"required":["source_node_id","parent_node_id","node_kind","role","evidence_refs","children"],"type":"object"},"minItems":1,"type":"array"},"root_node_id":{"$ref":"#/$defs/id"}},"required":["root_node_id","nodes"],"type":"object"},"synthetic":{"type":"boolean"},"unresolved_evidence":{"items":{"additionalProperties":false,"properties":{"evidence_refs":{"items":{"$ref":"#/$defs/eref"},"type":"array","uniqueItems":true},"owner":{"enum":["architect","ce","builder","responsive","user","unresolved"]},"reason":{"$ref":"#/$defs/s"},"state":{"const":"insufficient_evidence"},"unresolved_id":{"$ref":"#/$defs/id"}},"required":["unresolved_id","state","owner","reason","evidence_refs"],"type":"object"},"type":"array"},"validation_contract":{"additionalProperties":false,"properties":{"rules":{"items":{"enum":["CE-I01","CE-I02","CE-I03","CE-I04","CE-I05","CE-I06","CE-I07","CE-I08","CE-I09","CE-I10","CE-I11","CE-I12","CE-I13","CE-I14","CE-I15","CE-I16","CE-I17","CE-I18","CE-I19","CE-I20","CE-I21"]},"minItems":21,"type":"array","uniqueItems":true}},"required":["rules"],"type":"object"}},"required":["schema_id","schema_version","owner_repository","intake_status","synthetic","source_contract","source_repository_ref","project_gate_transition","selected_architecture","structure_projection","architect_intent_preserved","evidence_register","unresolved_evidence","forbidden_work","negative_boundary_assertions","ce_processing_prerequisites","mapping_contract","mapping_trace","legacy_contract_policy","real_cross_repository_validation","validation_contract"],"title":"EV4 CE Architect Stage Intake v1.1","type":"object"}
