{"schema_id":"ev4-ce-architect-stage-intake@1.1.0","schema_version":"1.1.0","owner_repository":"rezahh107/EV4-Constructability-Engineer-Repo","intake_status":"complete","synthetic":true,"source_contract":{"schema_id":"ev4-architect-stage-payload@1.0.0","schema_version":"1.0.0","owner_repository":"rezahh107/EV4-Architect-Repo","accepted_main_merge_commit":"b0651668b97f682bb17f66840c8e8c503fd3935d"},"source_repository_ref":{"repository":"rezahh107/EV4-Architect-Repo","ref":"synthetic-fixture","commit_sha":"b0651668b97f682bb17f66840c8e8c503fd3935d","bundle_id":"synthetic-architect-bundle-001"},"project_gate_transition":{"executed":true,"transition_id":"ev4-architect-to-ce-transition@1.0.0","transition_version":"1.0.0","producer_repository":"rezahh107/EV4-Project-Gate","source_bundle_id":"synthetic-architect-bundle-001","source_bundle_hash":{"algorithm":"sha256","canonicalization":"ev4-canonical-json.v1","scope":"source_bundle","value":"aaaaaaaaaaaaaaaaaaaaaaaaaaaaaaaaaaaaaaaaaaaaaaaaaaaaaaaaaaaaaaaa"}},"selected_architecture":{"selected_candidate_id":"ARCH-FAM-C","selected_candidate_locked":true,"architecture_family":"Relative Stage + Connector Layer","decision_source_refs":["ev-rec","ev-lock"],"approved_structure_ref":"node-root"},"structure_projection":{"root_node_id":"node-root","nodes":[{"source_node_id":"node-root","parent_node_id":null,"node_kind":"section_root","role":"smart_home_section","evidence_refs":["ev-stage7"],"children":["node-wrapper"]},{"source_node_id":"node-wrapper","parent_node_id":"node-root","node_kind":"wrapper","role":"normal_flow_grouping_wrapper","evidence_refs":["ev-stage7"],"children":[]}]},"architect_intent_preserved":{"class_intent":{"approved_class_names":["smart-home__section","smart-home__stage--relative"]},"responsive_risk_seeds":[{"risk_id":"risk-mobile-connectors","state":"insufficient_evidence","evidence_refs":["ev-stage7"]}],"dynamic_loop_intent":{"status":"none","evidence_refs":[]}},"evidence_register":[{"evidence_id":"ev-rec","state":"observed","source_ref":{"source_type":"stage_payload","reference":"/recommend synthetic"},"claim":"Stage 6 selected ARCH-FAM-C.","fact_class":"project_specific_behavior"},{"evidence_id":"ev-lock","state":"observed","source_ref":{"source_type":"stage_payload","reference":"/recommend lock synthetic"},"claim":"Selected candidate lock is present.","fact_class":"project_specific_behavior"},{"evidence_id":"ev-stage7","state":"observed","source_ref":{"source_type":"repo_path","reference":"stages/07_BUILD_TREE.md"},"claim":"Stage 7 owns structure and class intent.","fact_class":"contract_rule"},{"evidence_id":"ev-transition","state":"validated","source_ref":{"source_type":"transition_result","reference":"ev4-architect-to-ce-transition@1.0.0 synthetic"},"claim":"Project Gate Architect-to-CE transition executed for this intake.","fact_class":"transition_provenance"}],"unresolved_evidence":[{"unresolved_id":"unresolved-mobile-connectors","state":"insufficient_evidence","owner":"responsive","reason":"Mobile connector behavior lacks screenshot/export evidence.","evidence_refs":["ev-stage7"]}],"forbidden_work":["no_invent_geometry","no_invent_assets","no_invent_breakpoints","no_infer_dynamic_data","no_claim_builder_ready","no_claim_production_ready"],"negative_boundary_assertions":{"constructability_proven":false,"ce_approved":false,"implementation_strategy_selected":false,"elementor_feasibility_proven":false,"proof_state_resolved":false,"ce_review_complete":false,"builder_ready":false,"builder_executable":false,"builder_action_authorized":false,"builder_runtime_intake_authorized":false,"production_ready":false,"responsive_complete":false},"ce_processing_prerequisites":{"ce_review_required":true,"intake_contains_ce_conclusions":false,"intake_contains_builder_authorization":false,"real_cross_repository_validation_available":false},"mapping_contract":{"mapping_id":"ev4-architect-stage-to-ce-intake-mapping@1.1.0","mapping_version":"1.1.0","source_schema_id":"ev4-architect-stage-payload@1.0.0","target_schema_id":"ev4-ce-architect-stage-intake@1.1.0"},"mapping_trace":[{"source_path":"$.bundle_id","target_path":"$.project_gate_transition.source_bundle_id","classification":"direct_evidence_copy","ordering_rule":"not_applicable","missing_source_behavior":"invalid","duplicate_behavior":"not_applicable","unsupported_field_behavior":"not_applicable","provenance_behavior":"copy_exact","unresolved_evidence_behavior":"not_applicable"},{"source_path":"$.architecture_identity.selected_candidate_id","target_path":"$.selected_architecture.selected_candidate_id","classification":"direct_evidence_copy","ordering_rule":"not_applicable","missing_source_behavior":"invalid","duplicate_behavior":"reject","unsupported_field_behavior":"not_applicable","provenance_behavior":"preserve_reference","unresolved_evidence_behavior":"not_applicable"},{"source_path":"$.approved_structure_model.structure_nodes[]","target_path":"$.structure_projection.nodes[]","classification":"deterministic_structural_projection","ordering_rule":"sort_by_id","missing_source_behavior":"invalid","duplicate_behavior":"reject","unsupported_field_behavior":"reject","provenance_behavior":"preserve_reference","unresolved_evidence_behavior":"not_applicable"},{"source_path":"$.unresolved_evidence[]","target_path":"$.unresolved_evidence[]","classification":"direct_evidence_copy","ordering_rule":"preserve_source_order","missing_source_behavior":"omit_if_optional","duplicate_behavior":"reject","unsupported_field_behavior":"not_applicable","provenance_behavior":"copy_exact","unresolved_evidence_behavior":"copy_exact"}],"legacy_contract_policy":{"canonical_architect_facing_intake":"ev4-ce-architect-stage-intake@1.1.0","legacy_status":"v1.0.0_historical_compatibility"},"real_cross_repository_validation":"not_available","validation_contract":{"rules":["CE-I01","CE-I02","CE-I03","CE-I04","CE-I05","CE-I06","CE-I07","CE-I08","CE-I09","CE-I10","CE-I11","CE-I12","CE-I13","CE-I14","CE-I15","CE-I16","CE-I17","CE-I18","CE-I19","CE-I20"]}}
